Address Book Sql queries

1) UC1 

mysql> create database addressbook;
Query OK, 1 row affected (0.11 sec)

mysql> use  addressbook;
Database changed

2) UC2 

mysql> create table contact_details ( first_name varchar(150) not null  ,last_name varchar(150) not null, city varchar(150),state varchar(150),address varchar(150),zip int , phone_number bigint
    -> not null,email varchar(150),primary key(first_name));
Query OK, 0 rows affected (0.62 sec)

mysql> desc contact_details;
+--------------+--------------+------+-----+---------+-------+
| Field        | Type         | Null | Key | Default | Extra |
+--------------+--------------+------+-----+---------+-------+
| first_name   | varchar(150) | NO   | PRI | NULL    |       |
| last_name    | varchar(150) | NO   |     | NULL    |       |
| city         | varchar(150) | YES  |     | NULL    |       |
| state        | varchar(150) | YES  |     | NULL    |       |
| address      | varchar(150) | YES  |     | NULL    |       |
| zip          | int          | YES  |     | NULL    |       |
| phone_number | bigint       | NO   |     | NULL    |       |
| email        | varchar(150) | YES  |     | NULL    |       |
+--------------+--------------+------+-----+---------+-------+
8 rows in set (0.01 sec)

3) UC3 

mysql> insert into contact_details ( first_name,last_name,city,state,address,zip,phone_number,email) values ( 'Mark','Taylor','Hyderabad','Telanagan','Whitefield',500081,852741963,'abc@xyz.com');
Query OK, 1 row affected (0.10 sec)

mysql> insert into contact_details ( first_name,last_name,city,state,address,zip,phone_number,email) values ( 'Jason','James','Delhi','Haryana','WaterRock',700081,872741963,'opi@xyz.com');
Query OK, 1 row affected (0.23 sec)

mysql> select * from contact_details;
+------------+-----------+-----------+-----------+------------+--------+--------------+-------------+
| first_name | last_name | city      | state     | address    | zip    | phone_number | email       |
+------------+-----------+-----------+-----------+------------+--------+--------------+-------------+
| Jason      | James     | Delhi     | Haryana   | WaterRock  | 700081 |    872741963 | opi@xyz.com |
| Mark       | Taylor    | Hyderabad | Telanagan | Whitefield | 500081 |    852741963 | abc@xyz.com |
+------------+-----------+-----------+-----------+------------+--------+--------------+-------------+
2 rows in set (0.00 sec)

4) UC4

mysql> select * from contact_details;
+------------+-----------+-----------+-----------+------------+--------+--------------+-------------+
| first_name | last_name | city      | state     | address    | zip    | phone_number | email       |
+------------+-----------+-----------+-----------+------------+--------+--------------+-------------+
| Jason      | James     | Delhi     | Haryana   | WaterRock  | 700081 |    872741963 | opi@xyz.com |
| Mark       | Taylor    | Hyderabad | Telanagan | Whitefield | 500081 |    852741963 | abc@xyz.com |
+------------+-----------+-----------+-----------+------------+--------+--------------+-------------+
2 rows in set (0.00 sec)

mysql> update contact_details set last_name='Cali' where first_name='Jason';
Query OK, 1 row affected (0.12 sec)
Rows matched: 1  Changed: 1  Warnings: 0

mysql> select * from contact_details;
+------------+-----------+-----------+-----------+------------+--------+--------------+-------------+
| first_name | last_name | city      | state     | address    | zip    | phone_number | email       |
+------------+-----------+-----------+-----------+------------+--------+--------------+-------------+
| Jason      | Cali      | Delhi     | Haryana   | WaterRock  | 700081 |    872741963 | opi@xyz.com |
| Mark       | Taylor    | Hyderabad | Telanagan | Whitefield | 500081 |    852741963 | abc@xyz.com |
+------------+-----------+-----------+-----------+------------+--------+--------------+-------------+
2 rows in set (0.00 sec)

5) UC5

mysql> select * from contact_details;
+------------+-----------+-----------+-----------+------------+--------+--------------+-------------+
| first_name | last_name | city      | state     | address    | zip    | phone_number | email       |
+------------+-----------+-----------+-----------+------------+--------+--------------+-------------+
| Jason      | Cali      | Delhi     | Haryana   | WaterRock  | 700081 |    872741963 | opi@xyz.com |
| Mark       | Taylor    | Hyderabad | Telanagan | Whitefield | 500081 |    852741963 | abc@xyz.com |
+------------+-----------+-----------+-----------+------------+--------+--------------+-------------+
2 rows in set (0.00 sec)

mysql> delete from contact_details where first_name='Mark';
Query OK, 1 row affected (0.10 sec)

mysql> select * from conatact_details;
ERROR 1146 (42S02): Table 'addressbook.conatact_details' doesn't exist
mysql> select * from contact_details;
+------------+-----------+-------+---------+-----------+--------+--------------+-------------+
| first_name | last_name | city  | state   | address   | zip    | phone_number | email       |
+------------+-----------+-------+---------+-----------+--------+--------------+-------------+
| Jason      | Cali      | Delhi | Haryana | WaterRock | 700081 |    872741963 | opi@xyz.com |
+------------+-----------+-------+---------+-----------+--------+--------------+-------------+
1 row in set (0.00 sec)

6) UC6

mysql> select * from contact_details where city='Hyderabad';
+------------+-----------+-----------+-----------+------------+--------+--------------+-------------+
| first_name | last_name | city      | state     | address    | zip    | phone_number | email       |
+------------+-----------+-----------+-----------+------------+--------+--------------+-------------+
| Mark       | Taylor    | Hyderabad | Telanagan | Whitefield | 500081 |    852741963 | abc@xyz.com |
+------------+-----------+-----------+-----------+------------+--------+--------------+-------------+
1 row in set (0.00 sec)

mysql> select * from contact_details where state='Telanagan';
+------------+-----------+-----------+-----------+------------+--------+--------------+-------------+
| first_name | last_name | city      | state     | address    | zip    | phone_number | email       |
+------------+-----------+-----------+-----------+------------+--------+--------------+-------------+
| Mark       | Taylor    | Hyderabad | Telanagan | Whitefield | 500081 |    852741963 | abc@xyz.com |
+------------+-----------+-----------+-----------+------------+--------+--------------+-------------+
1 row in set (0.00 sec)

7)UC7

mysql> select count(*) from contact_details where state='Telanagan';
+----------+
| count(*) |
+----------+
|        1 |
+----------+
1 row in set (0.00 sec)

mysql> select count(*) from contact_details where city='Hyderabad';
+----------+
| count(*) |
+----------+
|        1 |
+----------+
1 row in set (0.00 sec)

8)UC8

mysql> select * from contact_details where city='Hyderabad' order by first_name asc;
+------------+-----------+-----------+-----------+------------+--------+--------------+-------------+
| first_name | last_name | city      | state     | address    | zip    | phone_number | email       |
+------------+-----------+-----------+-----------+------------+--------+--------------+-------------+
| Abby       | Cherry    | Hyderabad | Telanagan | Whitefield | 510081 |   8545691963 | 852@xyz.com |
| Mark       | Taylor    | Hyderabad | Telanagan | Whitefield | 500081 |    852741963 | abc@xyz.com |
+------------+-----------+-----------+-----------+------------+--------+--------------+-------------+
2 rows in set (0.00 sec)

mysql> select * from contact_details where city='Hyderabad' order by first_name desc;
+------------+-----------+-----------+-----------+------------+--------+--------------+-------------+
| first_name | last_name | city      | state     | address    | zip    | phone_number | email       |
+------------+-----------+-----------+-----------+------------+--------+--------------+-------------+
| Mark       | Taylor    | Hyderabad | Telanagan | Whitefield | 500081 |    852741963 | abc@xyz.com |
| Abby       | Cherry    | Hyderabad | Telanagan | Whitefield | 510081 |   8545691963 | 852@xyz.com |
+------------+-----------+-----------+-----------+------------+--------+--------------+-------------+
2 rows in set (0.00 sec)

9) UC9

mysql> alter table contact_details add address_book_name varchar(150) after email;
Query OK, 0 rows affected (0.34 sec)
Records: 0  Duplicates: 0  Warnings: 0

mysql> alter table contact_details add contact_type varchar(150) after email;
Query OK, 0 rows affected (1.63 sec)
Records: 0  Duplicates: 0  Warnings: 0

mysql> desc contact_details;
+-------------------+--------------+------+-----+---------+-------+
| Field             | Type         | Null | Key | Default | Extra |
+-------------------+--------------+------+-----+---------+-------+
| first_name        | varchar(150) | NO   | PRI | NULL    |       |
| last_name         | varchar(150) | NO   |     | NULL    |       |
| city              | varchar(150) | YES  |     | NULL    |       |
| state             | varchar(150) | YES  |     | NULL    |       |
| address           | varchar(150) | YES  |     | NULL    |       |
| zip               | int          | YES  |     | NULL    |       |
| phone_number      | bigint       | NO   |     | NULL    |       |
| email             | varchar(150) | YES  |     | NULL    |       |
| contact_type      | varchar(150) | YES  |     | NULL    |       |
| address_book_name | varchar(150) | YES  |     | NULL    |       |
+-------------------+--------------+------+-----+---------+-------+
10 rows in set (0.06 sec)

10) UC10

mysql> select count(*) from contact_details where contact_type='family';
+----------+
| count(*) |
+----------+
|        2 |
+----------+
1 row in set (0.00 sec)

11) UC11
mysql> select * from contact_details as cd right join contact_types as ct on cd.first_name=ct.first_name
    -> ;
+------------+-----------+-----------+-----------+------------+--------+--------------+-------------+-------------------+------------+--------------+
| first_name | last_name | city      | state     | address    | zip    | phone_number | email       | address_book_name | first_name | contact_type |
+------------+-----------+-----------+-----------+------------+--------+--------------+-------------+-------------------+------------+--------------+
| Abby       | Cherry    | Hyderabad | Telanagan | Whitefield | 510081 |   8545691963 | 852@xyz.com | myaddressbook     | Abby       | Family       |
| Abby       | Cherry    | Hyderabad | Telanagan | Whitefield | 510081 |   8545691963 | 852@xyz.com | myaddressbook     | Abby       | Friend       |
+------------+-----------+-----------+-----------+------------+--------+--------------+-------------+-------------------+------------+--------------+
2 rows in set (0.00 sec)

mysql> select cd.*,ct.contact_type from contact_details as cd right join contact_types as ct on cd.first_name=ct.first_name
    -> ;
+------------+-----------+-----------+-----------+------------+--------+--------------+-------------+-------------------+--------------+
| first_name | last_name | city      | state     | address    | zip    | phone_number | email       | address_book_name | contact_type |
+------------+-----------+-----------+-----------+------------+--------+--------------+-------------+-------------------+--------------+
| Abby       | Cherry    | Hyderabad | Telanagan | Whitefield | 510081 |   8545691963 | 852@xyz.com | myaddressbook     | Family       |
| Abby       | Cherry    | Hyderabad | Telanagan | Whitefield | 510081 |   8545691963 | 852@xyz.com | myaddressbook     | Friend       |
+------------+-----------+-----------+-----------+------------+--------+--------------+-------------+-------------------+--------------+
2 rows in set (0.00 sec)

12) UC12

mysql> desc contact_details;
+-------------------+--------------+------+-----+---------+-------+
| Field             | Type         | Null | Key | Default | Extra |
+-------------------+--------------+------+-----+---------+-------+
| first_name        | varchar(150) | NO   | PRI | NULL    |       |
| last_name         | varchar(150) | NO   |     | NULL    |       |
| city              | varchar(150) | YES  |     | NULL    |       |
| state             | varchar(150) | YES  |     | NULL    |       |
| address           | varchar(150) | YES  |     | NULL    |       |
| zip               | int          | YES  |     | NULL    |       |
| phone_number      | bigint       | NO   |     | NULL    |       |
| email             | varchar(150) | YES  |     | NULL    |       |
| address_book_name | varchar(150) | YES  |     | NULL    |       |
+-------------------+--------------+------+-----+---------+-------+
9 rows in set (0.03 sec)

mysql> show tables;
+-----------------------+
| Tables_in_addressbook |
+-----------------------+
| contact_details       |
| contact_types         |
+-----------------------+
2 rows in set (0.07 sec)

mysql> create table contact_addresses( street varchar(150) not null,city varchar(150) not null , state varchar(150) not null, zip int not null, country varchar(150) not null,first_name varchar(150)
    -> not null, foreign key(first_name) references contact_details(first_name));
Query OK, 0 rows affected (0.96 sec)


mysql> alter table contact_details drop column city;
Query OK, 0 rows affected (1.97 sec)
Records: 0  Duplicates: 0  Warnings: 0

mysql> alter table contact_details drop column state;
Query OK, 0 rows affected (1.48 sec)
Records: 0  Duplicates: 0  Warnings: 0

mysql> alter table contact_details drop column address;
Query OK, 0 rows affected (1.69 sec)
Records: 0  Duplicates: 0  Warnings: 0

mysql> alter table contact_details drop column zip;
Query OK, 0 rows affected (1.66 sec)
Records: 0  Duplicates: 0  Warnings: 0

mysql> desc contact_details;
+-------------------+--------------+------+-----+---------+-------+
| Field             | Type         | Null | Key | Default | Extra |
+-------------------+--------------+------+-----+---------+-------+
| first_name        | varchar(150) | NO   | PRI | NULL    |       |
| last_name         | varchar(150) | NO   |     | NULL    |       |
| phone_number      | bigint       | NO   |     | NULL    |       |
| email             | varchar(150) | YES  |     | NULL    |       |
| address_book_name | varchar(150) | YES  |     | NULL    |       |
+-------------------+--------------+------+-----+---------+-------+
5 rows in set (0.01 sec)

mysql> alter table contact_details add unique(first_name);
Query OK, 0 rows affected (0.95 sec)
Records: 0  Duplicates: 0  Warnings: 0

mysql> show tables;
+-----------------------+
| Tables_in_addressbook |
+-----------------------+
| contact_addresses     |
| contact_details       |
| contact_types         |
+-----------------------+
3 rows in set (0.06 sec)
